"<built-in function id>","Antonette","False","suscipit repellat esse quibusdam voluptatem incidunt"
"<built-in function id>","Antonette","True","distinctio vitae autem nihil ut molestias quo"
"<built-in function id>","Antonette","False","et itaque necessitatibus maxime molestiae qui quas velit"
"<built-in function id>","Antonette","False","adipisci non ad dicta qui amet quaerat doloribus ea"
"<built-in function id>","Antonette","True","voluptas quo tenetur perspiciatis explicabo natus"
"<built-in function id>","Antonette","True","aliquam aut quasi"
"<built-in function id>","Antonette","True","veritatis pariatur delectus"
"<built-in function id>","Antonette","False","nesciunt totam sit blanditiis sit"
"<built-in function id>","Antonette","False","laborum aut in quam"
"<built-in function id>","Antonette","True","nemo perspiciatis repellat ut dolor libero commodi blanditiis omnis"
"<built-in function id>","Antonette","False","repudiandae totam in est sint facere fuga"
"<built-in function id>","Antonette","False","earum doloribus ea doloremque quis"
"<built-in function id>","Antonette","False","sint sit aut vero"
"<built-in function id>","Antonette","False","porro aut necessitatibus eaque distinctio"
"<built-in function id>","Antonette","True","repellendus veritatis molestias dicta incidunt"
"<built-in function id>","Antonette","True","excepturi deleniti adipisci voluptatem et neque optio illum ad"
"<built-in function id>","Antonette","False","sunt cum tempora"
"<built-in function id>","Antonette","False","totam quia non"
"<built-in function id>","Antonette","False","doloremque quibusdam asperiores libero corrupti illum qui omnis"
"<built-in function id>","Antonette","True","totam atque quo nesciunt"
