2, Ervin Howell, True, distinctio vitae autem nihil ut molestias quo
2, Ervin Howell, True, voluptas quo tenetur perspiciatis explicabo natus
2, Ervin Howell, True, aliquam aut quasi
2, Ervin Howell, True, veritatis pariatur delectus
2, Ervin Howell, True, nemo perspiciatis repellat ut dolor libero commodi blanditiis omnis
2, Ervin Howell, True, repellendus veritatis molestias dicta incidunt
2, Ervin Howell, True, excepturi deleniti adipisci voluptatem et neque optio illum ad
2, Ervin Howell, True, totam atque quo nesciunt
